{"type":"relaymark.document","frontmatter":{"profile":"relaymark.agent_paper.v1","title":"Tuesday coaching cohort"},"blocks":[{"id":"b1","type":"heading","props":{"level":1},"content":[{"type":"text","text":"Tuesday coaching cohort"}]},{"id":"b2","type":"relay.property_sheet","props":{"binding":"paper.collection.properties","fields":["name","kind","member_count"],"presentation":"compact","title":"Collection"},"content":[{"id":"b3","type":"paragraph","content":[{"type":"text","text":"Collection identity"}]}]},{"id":"b4","type":"paragraph","content":[{"type":"text","text":"This cohort meets every Tuesday for a focused review and shared practice."}]},{"id":"b5","type":"relay.data_view","props":{"columns":["name","stage","next_commitment"],"group":"stage","limit":50,"projection":"list","sort":["name"],"source":"paper.collection.members","title":"Members"},"content":[{"id":"b6","type":"paragraph","content":[{"type":"text","text":"Authorized members"}]}]}],"annotations":[],"resources":[]}
