{"type":"relaymark.document","frontmatter":{"profile":"relaymark.agent_paper.v1","title":"Prepare coaching review"},"blocks":[{"id":"b1","type":"heading","props":{"level":1},"content":[{"type":"text","text":"Prepare coaching review"}]},{"id":"b2","type":"relay.entity_reference","props":{"id":"entity:task-prepare-review","label":"Prepare coaching review","projection":"link"},"content":[{"id":"b3","type":"paragraph","content":[{"type":"text","text":"Current task"}]}]},{"id":"b4","type":"relay.property_sheet","props":{"binding":"paper.task.properties","fields":["status","due_at","assignee"],"presentation":"stack","title":"Task"},"content":[{"id":"b5","type":"paragraph","content":[{"type":"text","text":"Structured task state is supplied by the host."}]}]},{"id":"b6","type":"paragraph","content":[{"type":"text","text":"Write the useful narrative here without copying the task status into prose."}]},{"id":"b7","type":"relay.action_row","props":{"action":"relay.task.complete","args":{},"review":"draft","target":"entity:task-prepare-review","visibility":"private"},"content":[{"type":"text","text":"Complete task"}]}],"annotations":[],"resources":[]}
