{
  "type": "relaymark.document",
  "frontmatter": {
    "title": "What Acts says about Aquila and Priscilla",
    "scope": "private",
    "profile": "relaymark.agent_answer",
    "outcome": "answered",
    "question_id": "sha256:6640f17d592931bf54f6d3bdf1c1b5f1a7a302bcdc4b7a2e626fd9671b6a1da8",
    "question": "What does Acts 18:2-3 say about Aquila and Priscilla?"
  },
  "blocks": [
    {
      "id": "askHeading1",
      "type": "heading",
      "props": {
        "level": 1
      },
      "content": [
        {
          "type": "text",
          "text": "What Acts says about Aquila and Priscilla"
        }
      ]
    },
    {
      "id": "askClaim1",
      "type": "relay.claim",
      "props": {
        "key": "scripture.ask.aquila-priscilla.acts-18-2-3",
        "status": "supported"
      },
      "evidence_refs": [
        "urn:relay:scripture:evidence:acts-18-2-3"
      ],
      "content": [
        {
          "type": "text",
          "text": "Acts 18:2-3 identifies Aquila as a Jewish man from Pontus, names Priscilla as his wife, and says their occupation was tentmaking."
        }
      ]
    },
    {
      "id": "askSourcesHeading1",
      "type": "heading",
      "props": {
        "level": 2
      },
      "content": [
        {
          "type": "text",
          "text": "Evidence"
        }
      ]
    },
    {
      "id": "askSourceBundle1",
      "type": "relay.source_bundle",
      "props": {
        "id": "urn:relay:scripture:source-bundle:ask-aquila-priscilla-1",
        "title": "Selected Scripture evidence",
        "revision": 1,
        "scope": "private"
      },
      "content": [
        {
          "id": "askEvidence1",
          "type": "relay.evidence_ref",
          "props": {
            "id": "urn:relay:scripture:evidence:acts-18-2-3",
            "source": "askScriptureRelease1",
            "source_type": "scripture",
            "source_revision": "urn:relay:scripture:corpus:kjv:1769-fixture-1",
            "selector": {
              "profile": "relaymark.scripture_span",
              "start": {
                "book_id": "ACT",
                "coordinate_kind": "chapter",
                "chapter": 18,
                "verse_label": "2"
              },
              "end": {
                "book_id": "ACT",
                "coordinate_kind": "chapter",
                "chapter": 18,
                "verse_label": "3"
              },
              "content_digest": "sha256:955b3b135b11ce43996ec910c7e32ff42d5f1e8b03894d967cc85322cd095683",
              "display_label": "Acts 18:2-3"
            },
            "label": "Acts 18:2-3",
            "scope": "public"
          },
          "content": [
            {
              "type": "text",
              "text": "And found a certain Jew named Aquila, born in Pontus, lately come from Italy, with his wife Priscilla; (because that Claudius had commanded all Jews to depart from Rome:) and came unto them. And because he was of the same craft, he abode with them, and wrought: for by their occupation they were tentmakers."
            }
          ]
        }
      ]
    }
  ],
  "resources": [
    {
      "id": "askScriptureRelease1",
      "type": "scripture",
      "label": "King James Version conformance excerpt",
      "scope": "public",
      "props": {
        "profile": "relaymark.scripture_release",
        "translation_id": "urn:relay:scripture:translation:kjv",
        "edition_id": "urn:relay:scripture:edition:kjv-1769-fixture",
        "corpus_release_id": "urn:relay:scripture:corpus:kjv:1769-fixture-1",
        "versification_id": "urn:relay:scripture:versification:kjv",
        "source": {
          "name": "King James Version RelayMark Ask conformance excerpt",
          "uri": "https://relaynotes.com/spec/relaymark/examples/scripture-ask-answered.ast.json",
          "digest": "sha256:955b3b135b11ce43996ec910c7e32ff42d5f1e8b03894d967cc85322cd095683"
        },
        "license": {
          "id": "public-domain",
          "name": "Public Domain",
          "url": "https://creativecommons.org/publicdomain/mark/1.0/"
        },
        "attribution": "King James Version (public-domain conformance excerpt)",
        "provenance": {
          "coordinate_inventory_digest": "sha256:e3eb70ac90174aef02ab4a9193304ed7285a1a8c0d9e0a93cf1e9fd90fbc3b28",
          "normalized_index_input_digest": "sha256:955b3b135b11ce43996ec910c7e32ff42d5f1e8b03894d967cc85322cd095683",
          "authority": "RelayMark Ask conformance fixture; not a corpus authorization",
          "imported_at": "2026-07-01T00:00:00Z"
        }
      }
    }
  ]
}
